,Job,Benefits,Description,Requirement,Skill
146,Deputy IT Manager (Hardware and IT Network Systems),Accident Insurance Opportunity for children to study at international school,"IT PROJECT MANAGEMENT • Responsible for set-up and layout of IT systems within schools according to the company’s guidelines • Coordinate and oversee ICT project implementation and setup as per approved layout / design and schedule of work operations for the completion of projects • Liaise with Finance to prepare / assess financial projections / requirements for ICT projects to maintain cost controls • Liaise with contractors / vendors and consultants in the area of ICT equipment and facilities set up and management • Supervise and monitor the progress of work to ensure timely and successful completion of ICT projects within the allocated budget and conduct regular on-site inspections. IT AND INFORMATION WORKS • Consolidate all IT requirements / infrastructure development / maintenance works and provide Management with feedback / suggestions for improvement / development of the entire IT system of the Company • Negotiate and liaise with IT contractors / vendors for the best IT deals / packages • Supervise and monitor IT implementation and maintenance works by IT staff and outside contractors / vendors • Support IT staff in providing service to end user in installing, configuring, modifying, decommissioning personal computers, notebooks, printers, scanners, network equipment, applications and other miscellaneous hardware and software etc • Responsible for the smooth operations and maintenance servers / networks-local LAN & WAN and ensure validity, reliability and consistency of data contained in the servers • Assist in implementation of IT projects and any other miscellaneous IT tasks • Minute all IT project meetings and file documents upon completion of projects and document IT configurations for hardware and software processes • Review performance of servers, network and operations procedures and data recovery of essential IT services OPERATION WORKS • Responsible for the smooth operations and maintenance of the schools / college / business unit servers and networks-local LAN & WAN, PC and other IT related equipment. • Ensure validity, reliability, and consistency of data contained in the servers are free from viruses • Ensure security and assess controls are in place to protect company’s data • Ensure that proper back up and contingency plans are implemented to minimise risk of data corruptions and losses • Prioritise / schedule work assignments and supervise / manage / evaluate performance of IT staff and provide relevant training for IT staff OTHERS • Assist in other duties / responsibilities assigned by the Management from time to time • This job description is not limited to the duties / responsibilities described above and will be subject to changes to incorporate any duties / responsibilities to reflect the job scope / business requirements.",Bachelor in IT / Electronics and Communication Engineering Great experience in IT Hardware and IT Network Systems Leadership Skill Project Management Good at English,"IT Networking Technology, IT Operations, IT System, IT Hardware"
147,Project Manager (Salary Up to $2500 Gross),13th month salary / Project incentive 12-day paid leave Training opportunity by top developers via pairing/review code,"- Manage teams in agile and iterative projects. - Project management and controlling (scope/time/budget). - Support requirements engineering and project estimations/offers. - Customer communication. - Coach and promote your team in retrospectives and performance reviews. - Support recruiting process in creating job ads, screen CVs and conduct interviews. - Location: HCMC, Vietnam","- 03+ years of experience in software development. - Bachelor's degree or equivalent with focus on computer science, information technology, systems development or a related field. - Experience in agile software development methods (Scrum or Kanban) or eager to learn them. - Good spoken and written command of English . - Communicates open and directly . - Positive thinker who creates a dynamic and positive working environment. - Able to break down high level requirements to implement customer needs. - Understands that quality is the most important thing. - Broad knowledge in mobile development and web application technologies. - Able to adjust your working time according the project schedule. *** Benefits: • Net salary: we will cover your medical, social and unemployment insurance for you as well as your personal income tax. • 13th month salary • Loyalty bonus: after the first year, you will receive a loyalty bonus equal to 50% of your current monthly salary each year. • 14 days annual leave • Regular team dinners and End Year Party. • Annual company trip and team building activities. • Others: company sponsored sport clubs, free coffee, snacks.","Scrum, Systems Development, Software Development, Agile Coach, Project Management"
148,Digital Acceleration Manager (Trưởng Phòng Chuyển Đổi Số),Competitive welfare regime: 13th and 14th monthly salaries; awarding achievements; bonuses on major Additional insurance: Accident 24/24; Inpatient insurance (hospitalization and surgery) Training Opportunities and Career Path Development,"Main Purpose of Job - Leadership role of the local IT services products in the respective functional area to ensure that relevant solutions and related capabilities to business. He/she is accountable for successful IT solutions in La Vie to accompany with IT manager to build long-term competitive advantage, leveraging new/advanced technologies to apply in company level (cross-functional). Responsible for IT solutions for a functional area across strategy, design, transition, operation and improvement activities. - Develop automation solutions to contribute to transform company operation to digital Responsibilities - Drive transformation of Technology Solutions to agile, evolved and high-tech approach in line with IT strategies: Business Anywhere, Business Enablement, Technology Enablement • Evolve Technology Solutions from a top/down implementation mode to a flexible, adding value and customized service provider. • Work close to the functional heads to analyze specifications and define needs in both Core and Edge solutions. • Simplify and make processes and communication channels leaner to develop more agility and responsiveness, integrating new business and technology trends. • Ensure solutions are fit for purpose and user friendly. - Ensure Sustain, Security and Compliance • Drive Flawless Execution in sustain (solution performance, availability and support organization). • Ensure implemented IT solutions meet internal and external standards in regards to compliance. Provide pro-active and reactive input on audit action plans in line with Nestle strategy/ vision. • Security & Compliance rules, policies, guidelines and standards, to the Business Continuity and IT Continuity rules, plans, guidelines and standards as decided by the Organization. - People & Communication • Develop future business leaders and ensuring attraction, development, rotation and retention of the right staff for current and future needs. • Establish and drive the execution of the People Developing Plan in the position's scope building relevant capabilities for IT. • Ensure adherence to the principles and practices of Nestle Continuous Excellence (NCE) e.g. LEAN - waste elimination approach/LEAN Office, leading to the reduction of service time and process optimization across all layers of the organization Utilize agreed communication channels: Intranet, Newsletters and Yammer...","• Have 2-3 years of experience in the same position. • Implementation of Digital Transformation projects (preferable using Microsoft technologies: Office365, SharePoint, Power Platform) • IoT, e-commerce, EDI projects • Implementation of systems integration: contact center, e-commerce, digital solutions, CRM, ERP, data warehouse • Cross functional knowledge and solid experience in processes and organization with end to end approach • Experience with an ITIL based locally and globally managed service organization • Security and Compliance Methodologies experience • Possesses good verbal and written English communication skills • Experience in driving suppliers","Application Management Services, Project Management, IOT Integration, Microsoft"
149,Automation Software Developer,13th month salary & Competitive Bonus & 14 days of annual leave Premium Healthcare Insurance Extensive training program,"- Internally develop softwares / applications / automation tools to help other teams increase their work efficiency. - Help graphic designing team with programning system / software for mass designing and reduce manual tasks. - Utilizes current graphic design technology and computer software packages to produce a variety of different products. - Develop new (or modify existing) softwares / tools based on customer's requests concepts or the given samples. - Design, develop, and adjust customer requests to meet production requirements & specifications. - Use software systems to produce original artwork or enhance existing artwork - Customize, maintain and continuously improve/develop new applications / software for new products - May train and guide junior-level graphic designers. - May participate in some developer / graphics designing projects - Design original or modify existing graphic concepts based on original layout or the sample - Ensure cost-efficiency when selecting alternative colors, sizes, etc. to present. - Produces graphic sketches, layouts, and designs, utilizing various techniques – e.g., using tools design software on computer for the initial development and illustration of ideas.","- 1-2 years experience as a software developer / graphic designer or related jobs . - Basic understanding of applicable computer systems/softwares languages such as: C#, PHP, .Net; Database: MySQL, SQL Server, Oracle DB ... - Well organized individual with an ability to handle multiple deadline driven projects simultaneously. - Basic in English, - Understanding of applicable computer systems/software, such as MAC OS, Adobe Photoshop, Adobe Indesign, File Maker & Illustrator, other function specific software, as well as Microsoft Office, Lotus Notes, illustration of ideas.","C#, .NET, PHP, Software Development, It Software"
150,Tuyển Dụng Cloud Engineer Lương Up To 40 Triệu,"Công ty chi trả tiền chuyển việc, phụ cấp đi lại, phụ cấp tiếng Nhật hấp dẫn. Tăng lương hàng năm, thưởng chuyên cần, lương tháng thứ 13, mua lại ngày phép còn dư. Du lịch công ty, Đại hội bóng đá, cầu lông, Tiệc tất niên, Tiệc Công Đoàn","1）Công ty R Techno tuyển dụng trực tiếp CÔNG TY BỐ TRÍ CHO NHÂN VIÊN LÀM VIỆC TẠI NHÀ (TẠI VN) (Đảm bảo đầy đủ chế độ như nhân viên làm việc tại Công Ty) - Phụ trách công việc cho khách hàng IT Nhật Bản - Số lượng tuyển dụng: 1 người (vị trí Leader) - Mức lương tuyển dụng: 30 triệu VNĐ ~ 40 triệu VNĐ (lương gross chính thức ) - Nội dung công việc:  Phát triển hệ thống phía máy chủ được liên kết với các ứng dụng của điện thoại thông minh  Xây dựng hệ thống trên AWS và phát triển các chương trình chạy trên AWS.  Sử dụng các ngôn ngữ: Node.js, Javascript, Java, C#, C++  Sử dụng phần mềm: Visual Studio or AndroidStudio - Vị trí Leader sử dụng tiếng Nhật làm việc trực tiếp với khách hàng phía Nhật Bản - Sẽ có chỉ thị sang Nhật đào tạo nếu cần thiết, hoặc khách hàng sẽ sang đào tạo trực tiếp tại VN. - Lịch phỏng vấn dự kiến: tháng 10 năm 2020 - Thời gian bắt đầu công việc dự kiến: từ tháng 11 hoặc từ tháng 12/2020 (Kế hoạch có thể bị lùi lại nếu chịu ảnh hưởng từ dịch Covid-19. Công ty sẽ chốt kế hoạch phỏng vấn sớm hơn ngày phỏng vấn chính thức ít nhất từ 1~2 tuần) 2) THÔNG TIN VỀ CÔNG TY TNHH RTECHNO VIỆT NAM Website Japan: http://www.r-techno.co.jp/ Website Việt Nam: https://vietnam.r-techno.co.jp/ Facebook: https://www.facebook.com/RTechno.Vietnam/","- Tốt nghiệp đại học chuyên ngành IT, hoặc các chuyên ngành có liên quan đến mảng IT - Trình độ giao tiếp tiếng Nhật thực tế tương đương N3 trở lên (không yêu cầu bằng cấp, chỉ xét trên năng lực tiếng Nhật thực tế làm việc) - Kỹ sư có kinh nghiệm xây dựng ứng dụng điện toán đám mây, phát triển phần mềm (Development), viết chương trình ứng dụng... - Ứng viên hiện đang sinh sống tại Nhật Bản cũng có thể ứng tuyển (sau khi đậu phỏng vấn có kế hoạch về VN làm việc) CHẾ ĐỘ VÀ QUYỀN LỢI - Lương tháng 13, tăng lương 1 lần/năm, thưởng Tết, thưởng chuyên cần - Mua lại ngày phép dư, phụ cấp đi lại, phụ cấp chứng chỉ tiếng Nhật. (chứng chỉ mới nhất từ năm 2019) - Bảo hiểm y tế, bảo hiểm xã hôi, bảo hiểm thất nghiệp và khám sức khỏe định kỳ mỗi năm 1 lần. - Nghỉ lễ, phép năm theo quy định của Nhà nước, Tết Dương Lịch. Ngoài ra, được nghỉ hè 5 ngày theo lịch của Nhật - Du lịch công ty hàng năm, Tất niên công ty hoành tráng, Đại hội thể thao tổ chức định kỳ (Bóng đá, Cầu lông,…) - Hỗ trợ chi phí chuyển việc khi bắt đầu vào làm việc tại Công ty: Hơn 20 triệuVNĐ (dành cho Member) và hơn 40 triệu VNĐ (dành cho Leader) - Hỗ trợ phí giới thiệu bạn bè tham dự phỏng vấn các vị trí Công ty đang tuyển dụng. (Liên hệ trực tiếp để nhận hỗ trợ)","IT Phần Mềm, Lập Trình Ứng Dụng, Điện Toán Đám Mây, Lập Trình Nhúng, Development Design"
151,Nhân Viên Vận Hành Hệ Thống Phần Mềm,"Thưởng theo năng lực và được đào tạo, cơ hội thăng tiến cao Hưởng đầy đủ các quyền lợi theo quy định theo Bộ luật lao động (BHXH, BHYT, BHTN) Có chế độ công tác phí theo quy định của nhà trường","11.1. Hỗ trợ người dùng sử dụng phần mềm: - Hướng dẫn người dùng sử dụng các chứ năng trên phần mềm - Kiêm tra xác định nguyên nhân khi người dùng báo lỗi. Hướng dẫn khắc phục và xử lý cho người dùng. - Xây dựng tài liệu hướng dẫn, tổ chức tập huấn các chức năng trên phần mềm cho người dùng 11.2 Quản trị hệ thống phần mềm: - Theo dõi việc chỉnh sửa cập nhật các chức năng trên phần mềm. - Phân tích nghiệp vụ từ quy trình thực tế để chuyên giao công ty phần mềm để xây dựng các chức năng đáp ứng - Thống kê dữ liệu từ phần mềm khi có yêu cầu từ Lãnh đạo/các bộ phận, phòng ban. - Ghi nhận các yêu cầu thay đổi/cập nhật/nâng cấp các chức năng trong hệ thống phần mềm. - Làm việc với công ty phần mềm để xây dựng các giải pháp ứng dụng hệ thống phần mềm xử lý các công việc của Trường. 11.3. Một số công việc khác - Thực hiện theo sự phân công của lãnh đạo Phòng Quản lý đào tạo.",- Hoạch định công việc và quản lý thời gian - Thuyết trình - Biên soạn và viết tài liệu - Xây dựng và duy trì mối quan hệ - Trình độ: Cao đẳng trở lên chuyên ngành về công nghệ thông tin,"Quản Lý Phần Mềm, Vận Hành Hệ Thống Server"
152,Chuyên Viên Khai Thác Hệ Thống Dữ Liệu,Chế độ lương bổng và đãi ngộ xứng đáng Chế độ chăm sóc sức khỏe toàn diện Chương trình đào tạo giúp nhân viên phát triển,"- Phối hợp và cùng tham gia với IT đảm bảo triển khai các phần mềm, ứng dụng quản lý bán hàng cho các NPP, Cửa hàng đối tác. Hướng dẫn, đào tạo các NV NPP, Cửa hàng Đối tác sử dụng thành thạo hệ thống - Quản trị cơ sở dữ liệu - Thực hiên các báo cáo theo dõi, đánh giá, phân tích tình hình thực hiện kinh doanh, KPI ... theo yêu cầu. - Tham gia các dự án liên quan quản lý bán hàng; quản lý hoạt động NVBH, PGs, GS, NPP - Nghiên cứu, đề xuất, áp dụng các phương pháp, công cụ, ứng dụng mới nhằm gia tăng hiệu quả khai thác, báo cáo, sử dụng số liệu trong công việc cho Kinh doanh hoặc các bộ phận có liên quan. - Giám sát, hỗ trợ, hướng dẫn thực hiện việc khai báo NVBH, NPP, Cửa hàng Đối tác, các tham số có liên quan đến hệ thống (tồn kho, bảng giá...) - Tham gia thực hiện và tuân thủ các quy trình hoạt động, các tài liệu ISO có liên quan. - Các công việc có liên quan theo sự phân công của cấp trên","HỌC VẤN & CHUYÊN NGÀNH: Tốt nghiệp đại học/ sau đại học, ưu tiên chuyên ngành: Tài chính Kế toán, Quản trị Kinh doanh, công nghệ thông tin … KINH NGHIỆM: - Có tối thiểu 3 năm kinh nghiệm làm việc trong lĩnh vực quản lý hệ thống ứng dụng bán hàng DMS, POS các ngành hàng tiêu dùng nhanh. - Có 2 năm kinh nghiệm tham gia vào các dự án ERP, DMS ... liên quan hệ thống phân phối bán hàng. KIẾN THỨC CHUYÊN MÔN & CÁC KỸ NĂNG: - Kiến thức về vận hành, quản trị hệ thống ERP, DMS... các phần mềm quản lý bán hàng - Kỹ năng lập kế hoạch và tổ chức. - Kỹ năng phân tích và xử lý dữ liệu. - Kỹ năng phát triển quan hệ hợp tác với đối tác. - Kỹ năng giải quyết vấn đề CÁC YÊU CẦU KHÁC: - Thành thạo vi tính văn phòng. - Chịu áp lực công việc cao - Trung thực","Data Control System, POS, ERP Operation, DMS, Data Analytics"
153,"IT GRC Senior Analyst (Governance, Risk, Compliance)Headhunt jobs",13rd salary and performance bonus Healthcare Package Oversea Outing Company trip,"(*) JOB SUMMARY: Execute and support GRC information security functions follow cybersecurity framework or adherence to standards, completion of risk assessments on internal processes, customer requirements and third parties, and identification and maintenance of risks as they go through the Risk Management lifecycle (*) ACCOUNTABILITIES: 1. GRC Security: • Security policies review and supporting procedures/ processes follow cybersecurity framework or adherence to standards • Work closely with IT teams or other departments to implement controls on security practices • Internal and external audits: - Assist with operating IT Risk assessments (organizational, business process, third party, etc.) - Co-operate security assessments (application, vulnerability, audit) • Coordinate written responses from customers and prospects on Information Security controls and regulatory compliance • Develop security compliance or routine reports • Assist in investigative and remediation efforts in case of security and compliance breaches • Promote security awareness and cultivate employees’ adherence to information security practices 2. Project Management: • Define scope of system and objective relate to IT Security • Assist to assesses the risks of various solutions and prioritizes competing business demands • Act as the bridge between stakeholders and development team to clarify","(*) QUALIFICATION & PERSONAL SPECIFICATION: 1. Qualification: - University graduation in Computer Science or computer-related field - 03+ years of experience in IT Security, IT Risk Management, Compliance, or related field 2. Knowledge, skills, and experience: - Knowledge of information security risk management frameworks and compliance practices - Ability to develop security standards and guidelines based on best practices and industry standards - Understanding of common security standards and regulations relating to the financial services industry (e.g. PCI DSS, GLBA, FDIC, SOX, SSAE18) and information security frameworks (NIST, CIS, ISO2700x, etc.) Soft-skills and attributes: - Ability to maintain a high level of discretion and confidentiality - Ability to work independently, proactively under high pressure with good problem-solving skills - Ability to interact with all levels - Be proactive, initiative, flexible, conscientious, responsible, honest, and prudent - Hard-working and ready to work in a pressured environment to meet the deadline - Good verbal and written communication skills in both English and Vietnamese - Good presentation skills - Good teamwork skills","IT Project Management, Audit, IT Risk Management, IT Governance, IT Security"
154,Network Operation Lead,"Wonderful and Human focus Environment Team activities (CSR, team buildings, company trips, monthly birthdays etc. Great working environment (music band, gym, relax corners, PS4, Baby foot, ping-pong table etc.)","The main responsibility is to assist the team in providing good quality customer service, including interacting with customers, answering customer inquiries, and effectively handling customer complaints. • Manage a technical team of level 2 and level 3 network engineers. • Motivate, animate and encourage good team spirit among the staff ( 1to1, team meetings, reporting, coaching). • Be a technical consultant when needed. • Assists HR team by participating in recruitment interviews • Supervise activities between internal and external resources, and facilitate smooth workflow for service delivery • Be available to management escalation. • Carrying any duties which may be requested of you within the perimeters of this role","- BSc/MSc in Computer Science or relevant major. - 3-year experiences in managing a technical team of more than 5 people. - ITIL - CCIE, JNCIE is a plus. - AWS/Azure certified is a plus. - Great communication skills in written & spoken English. French or Vietnamese are a plus - In-depth knowledge of networks technologies, especially large enterprise network. - Service oriented mindset. - Knowledge of one or more of the following topics will be an advantage:  Cloud systems (AWS, Azure, Alicloud…)  Linux or Unix-like system.  Network automation.  Storage and virtualization technologies. - Good interpersonal skills and experience in presenting - Good problem solving and negotiation skills - Great team working skills",English
155,Front End Developer / Angular,Chi tiết trao đổi trong buổi phỏng vấn.,"JOB OVERVIEW: You will join the SIMCEL Product team working on a groundbreaking product that will change the way supply chains are managed. The technological foundation of the product is based on Simulation and Machine Learning and allows to project easily any business into the future. The tool is highly data-driven and integrates complex business logics, yet it needs to be accessible to industry professionals having limited technical skills, thus the critical importance of the UI/UX. Beyond the engineers and developers, the team is also composed of Supply Chain experts to ensure the tool to be relevant to the industry. Your role will be to develop the interface and ensure offering multiple features within a sleek, innovative and functional design, where data visualisation is central. Interactions will be key to success and the company puts user perception at the top of its priority and gamification as the underlying philosophy. RESPONSIBILITIES AND DUTIES: ● Be in charge of designing, implementing and maintaining core features of our product ● Be in charge of Simcel's frontend implementation ● Be in charge of Simcel's frontend test coverage ● Ensure that features are developed with a high level of quality, as well as participate in our continuous refactoring endeavour. ● Be highly autonomous, especially be able to transform fuzzy, complex and various requirements into clear specifications, plan for their implementation and deliver. ● Support the Product owner to make work estimates and plannings regarding frontend functionalities ● Be a source of proposition to help the Product Owner / designers improve our user's experience ● Provide support to other developers for front end development ● Be extremely detail oriented when it comes to frontend UX edge cases handling ● Go the extra mile to ensure user experience will be the best possible in every potential scenarios","REQUIREMENTS ● At least 5 years as a web front end developer ● Angular: 3 years experience minimum ● Proven experience writing extensive test suites (in both unit and integration testing) ● Proven Experience delivering responsive design integration with a pixel perfect mindset ● Experience in code review ● Demonstrated experience in dashboarding / data science related apps ● Experience with the ngx-admin / nebular frameworks is a plus ● Excellent communication skills, total english fluency ● Experience working remotely ● Experience in multicultural work environment ● Autonomous. Driven. Excited to learn. ● Unix /Git / Docker / (opt: Kubernetes)","Web Development, IT Software, UX, Front End"
