,Job,Benefits,Description,Requirement,Skill
42,Senior Java Developer (Upper Level) - Cool Big Data Product,"Attractive salary, annual review, and quarterly recognition bonus. Flexible working hours, 2 days/month work from home, 15 days annual leave. Regular team building activities and company trips","Looking for strong, outstanding, persistent developers to work for our partner - GoodData - a US company which provides a massively scalable, secure & high-performance Insights Platform-as-a-Service for 70,000 businesses, over a million users. According to Forrester, insights-driven businesses will steal $1.2 Trillion/year from traditional market players by 2020. This is the transformation GoodData is enabling globally. By joining us, you won’t just grow your career, enjoy the life of a developer in LHV professional work environment. You’ll be part of a movement that is changing how people live, work and make decisions. Good salary & bonus: Attractive salary, annual review and quarterly recognition bonus. 13th salary paid before Tet. Premium health checkup and insurance. Learning & development support: English and IT courses support. Safari Books Online accounts support. Sport activities support. Pleasure environment: Flexible working hours, 2 days/month working from home, 15 days annual leave. Regular team building activities and company trips. Kitchens full of free refreshments. What you will do Contribute deeply to the architecture, design and implement Java-based enterprise application. Develop new features in a stable system with important factors such as security, scalability and performance. Troubleshoot and fix customer security issues. Learn and develop your coding skills as well as professional style in open-minded and international work culture.","Skills: Analytical, problem solving ability are your strengths. Experience working on multi-tasking and prioritizing. Able to work independently and collaboratively. Know how to make decisions, explanation and presentation. Ability/willingness to participate in Ops. Required Qualifications: 5+ years experience in software development: product specification, design, implementation, testing, release, and maintenance. Strong development experience with Java and willing to learn other programming languages. Hands-on experience in relational database design, transactional SQL and DBMS (Oracle, MSSQL, PostgreSQL, MySQL or Vertica). Hands-on experience in Unix environment Advantage Qualifications: Hands-on programming experience with one of the following: Spring framework, JavaScript, Ruby, shell scripting (Python/ Bash). Experience in REST API design, distributed systems, enterprise application, cloud based solutions. Experience in handling application security vulnerabilities. Experience protecting applications against security vulnerabilities. Hands-on experience in networking, preferably in cloud based environment (OpenStack private cloud). Experience with CI/CD Jenkins, Docker/Kubernetes and GIT. Experience with Splunk.","Ruby, Backend Server, Spring Cloud Stream, Java Webservice, Java"
43,IT Help-Desk - 3 Vị Trí,Thưởng thành tích,"a) Trước ca học - Kiểm tra có internet, điện thoại chạy ổn định trung tâm. - Phối hợp với AO điều phối đủ và đúng nhóm tablet của mỗi phòng (Samsung tablet hay Ipad). - Phối hợp với TA kiểm tra các thiết bị được sạc pin đầy đủ hay không. - Phối hợp với TA kiểm tra tương tác của phần mềm giảng dạy trên máy tính và trên tablet tại mỗi phòng học và phòng lab. - Hỗ trợ kỹ thuật khác khi có yêu cầu liên quan hệ thống và thiết bị giảng dạy và văn phòng. b) Trong ca hoc - Hỗ trợ kỹ thuật kịp thời cho các giáo viên các vấn đề liên quan đến chương trình giảng dạy khi có yêu cầu. - Email, gửi báo cáo báo cáo tức thời các vấn đề chưa giải quyết hay cần hỗ trợ của cấp trên. c) Sau ca học - Phối hợp TA thoát và tắt thiết bị trong phòng. - Phối hợp AO kiểm tra và nhận bàn giao đủ thiết bị cho CM. - Phản hồi và đóng phiếu yêu cầu trên hệ thống. Các yêu cầu công việc chính - Quản lý, cài đặt và bảo trì hệ thống máy tính , máy chiếu, Ipads, Tablets trong lớp học. - Quản trị hệ thống mạng LAN, internet, và camera tại trung tâm. - Cài đặt hệ điều hành, các phần mềm và hỗ trợ vận hành nhằm đáp ứng nhu cầu sử dụng của trung tâm. - Cập nhật các phần mềm Anti-Virus để bảo vệ máy tính, sửa chữa các sự cố về hệ điều hành, software, mạng LAN, mail của Trung tâm, sửa chữa và thay thế linh kiện phần cứng. - Cập nhật sự thay đổi về tình trạng tài sản. - Thực hiện ghi nhận, xin duyệt, quyết toán các chi phí IT khác. - Các công việc khác theo sự phân công của Quản lý.","- Kinh nghiệm: 01 năm ở vị trí tương đương - Giới tính: Nam , tuổi từ 22-30 - Bằng cấp: Cao đẳng trở lên. - Ưu tiên chứng chỉ quốc tế như CCNA, MCSA, MCSE… - Chuyên môn: công nghệ thông tin, mạng máy tính, điện tử, viễn thông. - Trình độ Anh văn: Giao tiếp được. - Yêu cầu khác: Nhiệt tình, chịu khó, khả năng giao tiếp, làm việc độc lập và nhóm tốt. - Thời gian làm việc theo ca, 48 giờ/tuần và có 1 ngày nghỉ trong tuần.","Giáo Dục Đào Tạo, It Helpdesk, It Support, Công Nghệ Thông Tin, Tin Học Ứng Dụng"
44,IT Coordinator,13th month salary + Bonus based on performance and company profit 6 days off besides 12 days off according to Labor Law Laptop and smartphone provided + monthly allowance for SIM,"The IT coordinator works closely with the other teams of the Global Delivery Center to ensure all the tasks and incidents are handled on time. He/she usually performs the following tasks : - Dispatch the incidents / tasks / requests - Follow the incidents resolution and escalate when necessary - Execute some daily checks (system status, backup, …) by following procedures","- Ticketing tool(s) - Microsoft 365 - SLA - Basic knowledge of SAP - English required, French is a big plus",IT System
45,Kỹ Sư Vận Hành Hệ Thống Contact Center,Laptop working. Participate in teambuiding / travel annually Domestic and foreign training.,"Vận hành hệ thống Concact Center Cisco, Avaya cho Khách hàng Kiểm tra lịch backup / kiểm tra tính ổn định của backup tasks cho hệ thống. Khôi phục hệ thống theo đúng ngữ cảnh trong thời gian cam kết. Theo dõi, phát hiện các vấn đề và nguy cơ xảy ra lỗi của hệ thống. Đưa ra kế hoạch xử lý lỗi hoặc bảo trì của hệ thống Kiểm tra tính đáp ứng, hoạt động ổn định của hệ thống khi có khách hàng mới được thêm vào Phối hợp với các team hỗ trợ các yêu cầu sau triển khai của khách hàng Phối hợp với các team triển khai các dự án mới liên quan Avaya, Cisco.","Tốt nghiệp chuyên ngành liên quan CNTT hoặc Điện Tử Viễn Thông, có ít nhất 03 kinh nghiệm trong lĩnh vực System, Server, Network, VMWare… Độ tuổi: Ưu tiên ứng viên dưới 32 tuổi. Có kinh nghiệm quản trị, vận hành hệ điều hành Window Server và Database SQL Server của Micrsoft HOẶC có kinh nghiệm quản trị, vận hành hệ điều hành Linux Server và database MySQL, Oracle. Kỹ năng giao tiếp, đọc, hiểu tài liệu tiếng Anh tốt. Có kiến thức căn bản, đọc hiểu code ít nhất một trong ngôn ngữ sau như PHP, . NET, Java Script…. Có kiến thức cơ bản về hệ thống tổng đài VoIP hoặc Analog là một lợi thế. Có kinh nghiệm nghiên cứu, triển khai tổng đài là một lợi thế. Đam mê công nghệ, cẩn thận, cầu tiến chịu khó học hỏi. Có tinh thần làm việc độc lập và khả năng làm việc nhóm. Thông tin khác: Mức lương: 600 – 1200 USD Thời gian làm việc: 8h-17h (từ thứ 2- thứ 6) KV làm việc: HCM hoặc HN Phúc lợi: Chế độ lương, thưởng hấp dẫn. Lương tháng 13 Tham gia teambuiding hàng năm Cấp laptop làm việc Thưởng các ngày lễ, tết, năm và các chế độ phúc lợi khác theo Luật lao động và chính sách của Cty Được tham gia đầy đủ BHXH, BHYT theo quy định nhà nước Du lịch hàng năm Cơ hội huấn luyện, thường xuyên đào tạo trong và ngoài nước từ Hãng đang là đối tác của công ty (Cisco, Avaya, Microsoft, Google…) Cơ hội thăng tiến Đồng nghiệp: Thân thiện - gắn kết","Hệ Thống Tổng Đài, System Engineer, Operations Engineer, Linux, Contact Center"
46,ServiceNow Software Engineer (Java/.net),"Attractive Salary, 13th month salary, English & Technical Incentives 18 leaves per year, Premium Healthcare Insurance package (1+1) Overseas Transfer Program (USA, UK, Finland, Australia, Japan, Germany, Singapore, etc.)","• Develops technical solutions for integrations into the Platform DXC ecosystem. This is an engineering role with technical skills in the context of software component integrations through the ServiceNow integration framework. Performs and provides automation for testing and integration of such systems, subsystems and components. • Participates in all technical aspects of the development projects and solution delivery pertaining to ServiceNow Integrations utilizing Agile/Scrum methodology • Interface with internal and external technical teams to successfully test and deliver to project requirements. • Demonstrate knowledge of REST/SOAP Web Services, the ability to code with Javascript, understanding of event driven development, understanding of database concepts and understanding of integration concepts between parties **Only shortlisted candidates will be contacted.","• Bachelor's degree in systems engineering, computer science, management information systems, or related field required. • At least 3 years' experience with .NET/Java/ Java Script code is required • Experience with REST/SOAP Webservices is required • Good verbal and written communication skills; Good speaking and understanding of the English Language • Ability to work collaboratively with other ServiceNow developers/SCRUM teams • Ability to Identify issues/deficiencies, and recommend solutions, with a mindset for continuous improvement • Ability to work independently and as part of a global team • Ability to work full time in a fast-paced environment; physically able to sit/stand at a computer and work in front of a computer screen for significant portions of the work day • Knowledge of ServiceNow components such as Service Catalog, Change/Incident/Problem Management, Asset Management, CMDB a plus. • ServiceNow Admin Training a plus. • Experience with JSON a plus • Knowledge of ServiceNow scripting and be able to work with forms, tables and navigate around in ServiceNow a plus. • Scrum / Agile Experience a plus","JavaScript, English, .NET, Java, ServiceNow"
47,IT Coordinator for Open Source Software (IT Background),13th-month salary bonus + Yearly Performance Bonus (very attractive) + Annual salary review Premium PVI insurance for you + 2 family members 16++ days of paid leave per year + Onsite opportunity,"The engineer will be involved with the code audit service. This involves learning the usage of Black Duck Protex & FOSSID tool, and using it for performing as per the responsibilities below. - To ensure compliance of Open Source Software (OSS) used in product development - Co-ordinate with development and legal teams for Open Source compliance activities during product life cycle - Review OSS components and approval of the same (through legal team) to be used in software development - Coordinate with external vendors wherever necessary for compliance to OSS usage in Software development If you don't like coding much, just check it out.","- Bachelors in Engineering (Electrical, Electronics, Instrumentation, Computer Science, Telecommunication, Master in Communication Applications) - 2 to 5 years in the area of Open Source Product Development & Coordination - Experienced in Open Source software development and design (using C/C++/Java) - Knowledge of Open Source Software architecture/Platforms (Linux/Eclipse/Android) - Good communication and task co-ordination skills - Experience with Linux OS will be preferred","Open Source, C#, Java, C++, Linux"
48,IT Team Leader,"Thưởng tuyển sinh, thưởng KPI và lương tháng 13 Cơm trưa tại canteen","- Manage the day to day IT activities at campus - Install, set up the necessary computers & IT devices in teacher’s room, classroom, ICT room, Lab room … and ensure they always function well as expected. - Plan of periodical maintenance for all IT Equipment at campus level. - Collaborate with IT central office to set up and install the network & system in campus according to IT Security Policy - Compliant to the guideline by IT central office in managing the IT Platform at campus - Supervise the project roll out initiated by Central Office in alignment with IT Project Governance. - Lead the process to make annual budget in their own campus and submit central office on time. - Manage IT inventory & completely manage full life cycle of IT devices at campus such as computers, desktops, Laptops, switch, router, wifi, camera, server, NAS, SAN, projector, printer, others … - Collaborate with Audit team in Central Office to undertake the annual counting for inventory of asset. - Manage access to Server Room/Network cabinet at campus and record in detail who enter the server room and reason in access log. - Periodically submit the report to IT central office following the standard template - Actively supervise the process to solve the tickets assigned to own campus and reasonably relocate them to technicians. - Ensure the tickets should be solved in expected timeline, alignment with SLA - Translate the initiative from local management & discuss and get approval by IT central office in order to have final best-suit solution for campus, in alignment with IT Strategy. - Identify the areas of improvement at campus level, actively share ideas/initiatives to all the colleagues among the campus. - Play the role of IT representative to announce, update the IT news at campus. - Monitor the team performance and motivate the team members - Create the inspiring team environment with an open communication - Set the goal and objectives for technicians at campus in order to achieve the KPI for whole IT Team at campus - Discover the training need and provide suitable training to technician - Build up the teamwork and solidarity","- Initial university degree in computer science - Having experience of Education Industry is advantage - Tech savvy with working knowledge of office Tools, PC Computing, Basic Networking, Printing, Drive Network, - Antivirus on Client Side, Update at Client Side … Ability to diagnose and resolve the basic technical issue - Have technique and practice for client enquiries, troubleshooting and problem resolution and prioritization. - Able to communicate in English - Teamwork spirit, self-motivated.","IT Service Desk, Service Desk Department, IT Support Leader, Technical Support, Team Management"
49,IT Infrastructure & Architecture Administrator,"KPI Assessment and 13th Salary Annual health check, tuition discount for 2 children Lunch, travelling and team building","- Support IT IA Manager in establishing the Strategic Plan for Infrastructure & Architecture which shall be in alignment with IT Strategic Plan - Play the role of Project Manager for some kinds of projects under Infrastructure & Architecture Section which will be assigned by IT IA Manager and ensure the project implementation is fully compliant with IT Project Governance in place. - Propose the new idea, initiative aiming to improve the employee’s productivity, save the cost to reduce the risk & really is beneficial to VAS. - Plays the one important role in IT Operational Process to maintain the services matching SLA – Level II Support in IT Service Support Structure. - Ensure the information security control in the Infrastructure & Architecture Platform to be in place and ensure all confidentiality of works in VAS should not be disclosed to any third-party for any purpose. Ensure the needed control to be installed in Infrastructure & Architecture system & Devices following to Information Security Policies. - Responsible for day to day operations to ensure Services in respective area shall be available in alignment with SLA which has been agreed with Business Executive. - The position strives for continuous improvement in systems & processes in the function in order to make the outputs user friendly, improve the business process, makes information more available to decision makers. - Actively participate into the process to ensure DRP and BCP active in place.","- Initial bachelor’s degree in computer science - Experienced in Network administrator at least 3 years - Have experience in Managing the complex Infrastructure system including AD, SAN Storage, Server Room, Wifi, Virtualization by Hyper-V or VMware, LAN/VLAN, WAN, Firewall, Proxy, DMZ, DNS, DHCP, WSUS, DC, PAM, SIEMS, Core switch - At least 5 of the following technical requirements: (1) Have at least CCNA/CCNP certificate or equivalent knowledge (2) Strong experience in planning IP address and IP Routing/ Switching/ Packet Filtering (3) Strong experience in configuring network devices such as Cisco, Fortigate, HP (4) Good knowledge and experience in Networking and Security (5) Have knowledge about Voice system (6) Having experience in administrating Enterprise email system such as Microsoft Exchange / 365 such as Teams, Notes, Itune (7) Having experience in administrating the Domain AD system for Enterprise including DC, DNS, DHCP, WSUS, SCCM, RADIUS, NAP, AZURE AD CLOUD - Effective thinking, good communication skills, problem solving and teamwork - Computer skills: Proficient in Word, Excel, Power Point - Good English skill (written and verbal) is highly preferred - Careful, accurate, collaborative - Withstand high pressure","Ccna, Infrastructure, Security Administrator, Networking Capabilities, Network Administration"
50,20 Hardware Design Engineer ( IC Design - Logic/ Physical Design ) _ Fresh Graduates,15 annual day + 1 / Allowance Bonus (twice/year) / Excellent Training program/ Oversea training / Private Healthcare Laptop provided,"I. Logic Design Involve in some or all aspects of digital integrated circuit design from initial concept through to design and verification of Chip (SoC/ASIC), IP/Peripheral and CPU core by hardware description language (Verilog HDL) or High-Level language (C/C++) Tham gia một vài hoặc tất cả các công đoạn thiết kế và phát triển vi mạch số từ ý tưởng đến thiết kế và kiểm thử SoC/ASIC, Mô đun ngoại vi, và bộ vi xử lý bằng ngôn ngữ thiết kế phần cứng hoặc ngôn ngữ cấp cao (C/C++) Evaluate and test prototype on FPGA or Functional Evaluate of actual Chip Đánh giá và kiểm tra mẫu thiết kế trên chip FPGA hoặc đánh giá chức năng của chip thật. Initially mentored by a senior engineer, your role will be to understand and simulate existing circuits, making design changes as requested and/or participation in test and evaluation of completed designs. Bắt đầu với sự hướng dẫn của kỹ sư có kinh nghiệm, yêu cầu công việc là hiểu rõ và mô phỏng các thiết kế có sẳn, thực hiện các thay đổi theo yêu cầu hoặc/và tham gia kiểm tra, đánh giá một thiết kế hoàn chỉnh. II. Physical Design/ DFT Physical Design: physical synthesis, place & route, timing closure and timing/physical verification for IP, CPU and Chip design. Tổng hợp thiết kế logic theo vật lý, sắp đặt và định tuyến, thiết kế mạch thời gian (timing), kiểm tra sự thích hợp của mạch thời gian và yêu cầu vật lý cho sản xuất ở cấp độ module và cấp độ Chip DFT: Design for testability (Memory/Logic BIST, SCAN, Boundary Scan) insertion, verification and test pattern generation for IP, CPU and Chip design Thiết kế mạch kiểm tra tích hợp để kiểm tra hoạt động của vi mạch sau khi sản xuất nhằm phân loại các sản phẩm tốt và sản phẩm lỗi trước khi giao cho khách hàng. Join training program to master EDA tools before actual job Được đào tạo sử dụng các phần mềm thiết kế vi mạch chuyên nghiệp và cao cấp nhất hiện nay Initially mentored by a senior engineer in actual job Được hướng dẫn trực tiếp và thường xuyên từ những kĩ sư nhiều kinh nghiệm trong ngành bán dẫn","- Fresh university graduates with major in Electronics, Telecommunications, Mechatronics, Automation, Computer Science, Computer Engineering, Information Technology, Mathematics – Computer Science, Physics – Electronics, and Physics – Computer Science - Good at English in both writing and speaking skills, distinguished competence, consistent in pursuing of excellence, professional behavior, and good relationships with others and society. - Have strong passion in technical field, especially in chip design. - Have logical thinking and explanation; be serious and mature in working attitude - Long term working commitment (at least two years after completion of the training program) with company is a MUST","Physical Design, Logic Design, Hardware Design, Verilog Design, C Programming Language"
51,System Intergration Engineer,"Mức lương: 600 – 1100 USD Cơ hội huấn luyện,đào tạo trong/ngoài nước từ Hãng đang là đối tác như (Cisco,Microsoft,Google…) Cấp laptop làm việc","• Khảo sát & báo cáo hạ tầng CNTT của khách hàng. • Lập kế hoạch, thuyết trình, báo cáo kỹ thuật các bước triển khai cho khách hàng, quản lý dự án triển khai cho khách hàng. • Triển khai hệ thống máy chủ, thiết bị mạng LAN, WAN theo thiết kế mạng trong dự án, Cấu hình các tính năng cơ bản & nâng cao các thiết bị tường lửa, UTM thông dụng. • Cấu hình thiết bị không dây như AP, controller, thiết lập truy cập cơ bản và nâng cao. • Đào tạo cho người sử dụng về hệ thống/ thiết bị đã triển khai.","• Tốt nghiệp ĐH/CĐ chuyên ngành Khoa học máy tính, CNTT (network, hardware). • Độ tuổi: 25 - 35 tuổi • Có kinh nghiêm triển khai hạ tầng trên nền tảng Cisco/ HP/ Dell... các hạ tầng trên nền tảng Microsoft ( MS Windows server, MS SQL server, ...) • Có kiến thức về tích hợp hệ thống ảo hóa Vmware, HyperV, Linux ... • Có kiến thức về hạ tầng CNTT: Server, SAN, Swicth, Firewall, Wifi,… • Có kiến thức, kinh nghiệm về TCP/IP Subnetting/ VLANs/ dot1q/ Qin/ Spaningtree/ VRRP/ QOS Private/ Routing protocols: OSPF, BGP and MPLS là một lợi thế. • Ứng viên có chứng chỉ CCNA/MCSA/MCSE tương đương hoặc cao hơn là một lợi thế. • Ưu tiên ứng viên đã từng làm việc cho bên B. • Có thể triển khai về Security, có kinh nghiệm tạo & phát triển Security Policies. • Có khả năng thiết kế và tối ưu hóa các hệ thống mạng tích hợp. • Kỹ năng trình bày, giao tiếp tốt qua đối thoại và bằng văn bản. • Kỹ năng tổ chức, lập kế hoạch và quản lý dự án. • Tiếng Anh giao tiếp tốt với đối tác, nắm rõ tài liệu chuyên ngành. LƯƠNG VÀ PHÚC LỢI CÔNG VIỆC: • Mức lương: 600 – 1100 USD • Chế độ lương, thưởng hấp dẫn. Lương tháng 13. • Tham gia teambuiding/du lịch hàng năm. • Cấp laptop làm việc • Thưởng các ngày lễ, tết, năm và các chế độ phúc lợi khác theo Luật lao động và chính sách của Công ty. • Cơ hội huấn luyện, thường xuyên đào tạo trong và ngoài nước từ Hãng đang là đối tác của công ty (Cisco, Microsoft, Google…) • Được tham gia đầy đủ BHXH, BHYT theo quy định nhà nước • Cơ hội thăng tiến. • Đồng nghiệp: Thân thiện - gắn kết.","System Integrator, Hạ Tầng, Microsoft, Công Nghệ Thông Tin, Network"
